{
  "artifact_id": "pascal-hbc-demo-v1",
  "source_kind": "SYNTHETIC_FIXTURE",
  "package_lock_digest": "15fd3dae4d0d5ed5a52122af9ba5f62454947f56a7e19f218cd395caa563a2f7",
  "scene_json_sha256": "eafed1a7c858041e14195dc7e734fb97da0e03ce9facf09c156b09f655587e66",
  "root_node_id": "building-hbc",
  "storey_ids": [
    "L1",
    "L2"
  ],
  "node_bindings": [
    {
      "node_id": "building-hbc",
      "node_kind": "Building",
      "aura_entity_id": "construction-building-hbc",
      "aura_target_ref": "construction://hbc-demo/L1/building-hbc",
      "storey_id": "L1",
      "selectable": false
    },
    {
      "node_id": "level-l1",
      "node_kind": "Level",
      "aura_entity_id": "construction-level-l1",
      "aura_target_ref": "construction://hbc-demo/L1/level-l1",
      "storey_id": "L1",
      "selectable": false
    },
    {
      "node_id": "room-retail-l1",
      "node_kind": "Zone",
      "aura_entity_id": "construction-room-retail-l1",
      "aura_target_ref": "construction://hbc-demo/L1/room-retail-l1",
      "storey_id": "L1",
      "selectable": true
    },
    {
      "node_id": "room-service-l1",
      "node_kind": "Zone",
      "aura_entity_id": "construction-room-service-l1",
      "aura_target_ref": "construction://hbc-demo/L1/room-service-l1",
      "storey_id": "L1",
      "selectable": true
    },
    {
      "node_id": "room-staging-l1",
      "node_kind": "Zone",
      "aura_entity_id": "construction-room-staging-l1",
      "aura_target_ref": "construction://hbc-demo/L1/room-staging-l1",
      "storey_id": "L1",
      "selectable": true
    },
    {
      "node_id": "room-entry-l1",
      "node_kind": "Zone",
      "aura_entity_id": "construction-room-entry-l1",
      "aura_target_ref": "construction://hbc-demo/L1/room-entry-l1",
      "storey_id": "L1",
      "selectable": true
    },
    {
      "node_id": "wall-north-l1",
      "node_kind": "Wall",
      "aura_entity_id": "construction-wall-north-l1",
      "aura_target_ref": "construction://hbc-demo/L1/wall-north-l1",
      "storey_id": "L1",
      "selectable": false
    },
    {
      "node_id": "wall-east-l1",
      "node_kind": "Wall",
      "aura_entity_id": "construction-wall-east-l1",
      "aura_target_ref": "construction://hbc-demo/L1/wall-east-l1",
      "storey_id": "L1",
      "selectable": false
    },
    {
      "node_id": "wall-south-l1",
      "node_kind": "Wall",
      "aura_entity_id": "construction-wall-south-l1",
      "aura_target_ref": "construction://hbc-demo/L1/wall-south-l1",
      "storey_id": "L1",
      "selectable": false
    },
    {
      "node_id": "wall-west-l1",
      "node_kind": "Wall",
      "aura_entity_id": "construction-wall-west-l1",
      "aura_target_ref": "construction://hbc-demo/L1/wall-west-l1",
      "storey_id": "L1",
      "selectable": false
    },
    {
      "node_id": "wall-core-l1",
      "node_kind": "Wall",
      "aura_entity_id": "construction-wall-core-l1",
      "aura_target_ref": "construction://hbc-demo/L1/wall-core-l1",
      "storey_id": "L1",
      "selectable": false
    },
    {
      "node_id": "level-l2",
      "node_kind": "Level",
      "aura_entity_id": "construction-level-l2",
      "aura_target_ref": "construction://hbc-demo/L2/level-l2",
      "storey_id": "L2",
      "selectable": false
    },
    {
      "node_id": "room-office-l2",
      "node_kind": "Zone",
      "aura_entity_id": "construction-room-office-l2",
      "aura_target_ref": "construction://hbc-demo/L2/room-office-l2",
      "storey_id": "L2",
      "selectable": true
    },
    {
      "node_id": "room-mechanical-l2",
      "node_kind": "Zone",
      "aura_entity_id": "construction-room-mechanical-l2",
      "aura_target_ref": "construction://hbc-demo/L2/room-mechanical-l2",
      "storey_id": "L2",
      "selectable": true
    },
    {
      "node_id": "room-training-l2",
      "node_kind": "Zone",
      "aura_entity_id": "construction-room-training-l2",
      "aura_target_ref": "construction://hbc-demo/L2/room-training-l2",
      "storey_id": "L2",
      "selectable": true
    },
    {
      "node_id": "room-storage-l2",
      "node_kind": "Zone",
      "aura_entity_id": "construction-room-storage-l2",
      "aura_target_ref": "construction://hbc-demo/L2/room-storage-l2",
      "storey_id": "L2",
      "selectable": true
    },
    {
      "node_id": "wall-north-l2",
      "node_kind": "Wall",
      "aura_entity_id": "construction-wall-north-l2",
      "aura_target_ref": "construction://hbc-demo/L2/wall-north-l2",
      "storey_id": "L2",
      "selectable": false
    },
    {
      "node_id": "wall-east-l2",
      "node_kind": "Wall",
      "aura_entity_id": "construction-wall-east-l2",
      "aura_target_ref": "construction://hbc-demo/L2/wall-east-l2",
      "storey_id": "L2",
      "selectable": false
    },
    {
      "node_id": "wall-south-l2",
      "node_kind": "Wall",
      "aura_entity_id": "construction-wall-south-l2",
      "aura_target_ref": "construction://hbc-demo/L2/wall-south-l2",
      "storey_id": "L2",
      "selectable": false
    },
    {
      "node_id": "wall-west-l2",
      "node_kind": "Wall",
      "aura_entity_id": "construction-wall-west-l2",
      "aura_target_ref": "construction://hbc-demo/L2/wall-west-l2",
      "storey_id": "L2",
      "selectable": false
    },
    {
      "node_id": "wall-core-l2",
      "node_kind": "Wall",
      "aura_entity_id": "construction-wall-core-l2",
      "aura_target_ref": "construction://hbc-demo/L2/wall-core-l2",
      "storey_id": "L2",
      "selectable": false
    }
  ],
  "repository": "pascalorg/editor",
  "commit": "42ac4be1ce5f3fee74806aa093267b6fee77d47d",
  "working_copy_only": true,
  "persistent_scene_mutation": false,
  "external_asset_fetch": false,
  "destroy_on_dissolution": true,
  "construction_truth": false,
  "survey_authority": false,
  "version": "AURA_PASCAL_SCENE_ARTIFACT_MANIFEST_V1",
  "artifact_digest": "ac48f68fdec52ae0d78a1f533cfa4cc92005b11fdd62076200f5f779239fe630"
}
